{
  "id": "SUW-NNN",
  "title": "",
  "slug": "",
  "state": "planned",
  "status_goal": "",
  "stage": "pre_implementation",
  "target_depth": 1,
  "completion_criteria": [],
  "dependencies": [],
  "blockers": [],
  "target_sections": [],
  "related_sections": [],
  "ai_activity": "interrogate",
  "created_at": "",
  "updated_at": "",
  "timestamps": {}
}